{
  "bundle": "trooth.verification-bundle.v1",
  "created_at": "2026-10-06T20:21:01.631Z",
  "domain": "trooth.co",
  "statement": {
    "payload": "{\"statement\":\"trooth.witness-statement.v2\",\"reading_id\":\"rw_mux3srh0_ae207512e4b943d4\",\"domain\":\"trooth.co\",\"read_at\":\"2026-10-06T20:00:44.820Z\",\"subject_scope\":{\"domain\":\"trooth.co\",\"surface\":\"public\",\"checks_in_scope\":100},\"methodology\":{\"standard\":\"Trooth Standard 1.0\",\"mapping_version\":\"1.0.1\",\"mapping_url\":\"https://trooth.co/standard/check-mapping/1.0.1.json\",\"mapping_digest\":\"sha256:6fea8a0f44a6a47dd0604823a8a65d93055f0e341d016d495cb5d2f73e3d424c\"},\"evaluator\":{\"name\":\"trooth-scan-worker\",\"version\":\"2026-10-04.1\"},\"evidence_manifest\":{\"digest\":\"sha256:d412e50d48ac8d3134389efddde69cdb04f35aa5d927090f5ea6501d33a03d79\",\"entries\":100,\"canonicalization\":\"trooth.evidence-manifest.v1: JSON array sorted by check_id, keys check_id then source or commitment, no whitespace, UTF-8\"},\"checks\":[{\"id\":\"L1\",\"category\":\"legal\",\"kind\":\"probe\",\"outcome\":\"as expected\",\"reason\":null},{\"id\":\"L2\",\"category\":\"legal\",\"kind\":\"probe\",\"outcome\":\"as expected\",\"reason\":null},{\"id\":\"L3\",\"category\":\"legal\",\"kind\":\"probe\",\"outcome\":\"as expected\",\"reason\":null},{\"id\":\"L4\",\"category\":\"legal\",\"kind\":\"attest\",\"outcome\":\"not read\",\"reason\":{\"code\":\"carried_from_earlier_reading\",\"version\":\"trooth.check-explanations.v1\",\"source_ref\":null,\"withheld\":true,\"withheld_reason\":\"The source is the company's own form declaration, which is not published; its reference is committed in the evidence manifest.\"}},{\"id\":\"L5\",\"category\":\"legal\",\"kind\":\"probe\",\"outcome\":\"as expected\",\"reason\":null},{\"id\":\"L6\",\"category\":\"legal\",\"kind\":\"probe\",\"outcome\":\"as expected\",\"reason\":null},{\"id\":\"L7\",\"category\":\"legal\",\"kind\":\"probe\",\"outcome\":\"as expected\",\"reason\":null},{\"id\":\"L8\",\"category\":\"legal\",\"kind\":\"probe\",\"outcome\":\"as expected\",\"reason\":null},{\"id\":\"L9\",\"category\":\"legal\",\"kind\":\"probe\",\"outcome\":\"as expected\",\"reason\":null},{\"id\":\"L10\",\"category\":\"legal\",\"kind\":\"probe\",\"outcome\":\"as expected\",\"reason\":null},{\"id\":\"S1\",\"category\":\"security\",\"kind\":\"probe\",\"outcome\":\"as expected\",\"reason\":null},{\"id\":\"S2\",\"category\":\"security\",\"kind\":\"probe\",\"outcome\":\"as expected\",\"reason\":null},{\"id\":\"S3\",\"category\":\"security\",\"kind\":\"attest\",\"outcome\":\"not read\",\"reason\":{\"code\":\"carried_from_earlier_reading\",\"version\":\"trooth.check-explanations.v1\",\"source_ref\":null,\"withheld\":true,\"withheld_reason\":\"The source is the company's own form declaration, which is not published; its reference is committed in the evidence manifest.\"}},{\"id\":\"S4\",\"category\":\"security\",\"kind\":\"attest\",\"outcome\":\"not read\",\"reason\":{\"code\":\"carried_from_earlier_reading\",\"version\":\"trooth.check-explanations.v1\",\"source_ref\":null,\"withheld\":true,\"withheld_reason\":\"The source is the company's own form declaration, which is not published; its reference is committed in the evidence manifest.\"}},{\"id\":\"S5\",\"category\":\"security\",\"kind\":\"probe\",\"outcome\":\"as expected\",\"reason\":null},{\"id\":\"S6\",\"category\":\"security\",\"kind\":\"attest\",\"outcome\":\"not read\",\"reason\":{\"code\":\"carried_from_earlier_reading\",\"version\":\"trooth.check-explanations.v1\",\"source_ref\":null,\"withheld\":true,\"withheld_reason\":\"The source is the company's own form declaration, which is not published; its reference is committed in the evidence manifest.\"}},{\"id\":\"S7\",\"category\":\"security\",\"kind\":\"probe\",\"outcome\":\"as expected\",\"reason\":null},{\"id\":\"S8\",\"category\":\"security\",\"kind\":\"attest\",\"outcome\":\"not read\",\"reason\":{\"code\":\"carried_from_earlier_reading\",\"version\":\"trooth.check-explanations.v1\",\"source_ref\":null,\"withheld\":true,\"withheld_reason\":\"The source is the company's own form declaration, which is not published; its reference is committed in the evidence manifest.\"}},{\"id\":\"S9\",\"category\":\"security\",\"kind\":\"probe\",\"outcome\":\"as expected\",\"reason\":null},{\"id\":\"S10\",\"category\":\"security\",\"kind\":\"attest\",\"outcome\":\"not read\",\"reason\":{\"code\":\"carried_from_earlier_reading\",\"version\":\"trooth.check-explanations.v1\",\"source_ref\":null,\"withheld\":true,\"withheld_reason\":\"The source is the company's own form declaration, which is not published; its reference is committed in the evidence manifest.\"}},{\"id\":\"A1\",\"category\":\"ai\",\"kind\":\"probe\",\"outcome\":\"as expected\",\"reason\":null},{\"id\":\"A2\",\"category\":\"ai\",\"kind\":\"probe\",\"outcome\":\"as expected\",\"reason\":null},{\"id\":\"A3\",\"category\":\"ai\",\"kind\":\"attest\",\"outcome\":\"not read\",\"reason\":{\"code\":\"carried_from_earlier_reading\",\"version\":\"trooth.check-explanations.v1\",\"source_ref\":null,\"withheld\":true,\"withheld_reason\":\"The source is the company's own form declaration, which is not published; its reference is committed in the evidence manifest.\"}},{\"id\":\"A4\",\"category\":\"ai\",\"kind\":\"probe\",\"outcome\":\"as expected\",\"reason\":null},{\"id\":\"A5\",\"category\":\"ai\",\"kind\":\"probe\",\"outcome\":\"as expected\",\"reason\":null},{\"id\":\"A6\",\"category\":\"ai\",\"kind\":\"attest\",\"outcome\":\"not read\",\"reason\":{\"code\":\"carried_from_earlier_reading\",\"version\":\"trooth.check-explanations.v1\",\"source_ref\":null,\"withheld\":true,\"withheld_reason\":\"The source is the company's own form declaration, which is not published; its reference is committed in the evidence manifest.\"}},{\"id\":\"A7\",\"category\":\"ai\",\"kind\":\"attest\",\"outcome\":\"not read\",\"reason\":{\"code\":\"carried_from_earlier_reading\",\"version\":\"trooth.check-explanations.v1\",\"source_ref\":null,\"withheld\":true,\"withheld_reason\":\"The source is the company's own form declaration, which is not published; its reference is committed in the evidence manifest.\"}},{\"id\":\"A8\",\"category\":\"ai\",\"kind\":\"attest\",\"outcome\":\"not read\",\"reason\":{\"code\":\"carried_from_earlier_reading\",\"version\":\"trooth.check-explanations.v1\",\"source_ref\":null,\"withheld\":true,\"withheld_reason\":\"The source is the company's own form declaration, which is not published; its reference is committed in the evidence manifest.\"}},{\"id\":\"A9\",\"category\":\"ai\",\"kind\":\"probe\",\"outcome\":\"as expected\",\"reason\":null},{\"id\":\"A10\",\"category\":\"ai\",\"kind\":\"attest\",\"outcome\":\"not read\",\"reason\":{\"code\":\"carried_from_earlier_reading\",\"version\":\"trooth.check-explanations.v1\",\"source_ref\":null,\"withheld\":true,\"withheld_reason\":\"The source is the company's own form declaration, which is not published; its reference is committed in the evidence manifest.\"}},{\"id\":\"B1\",\"category\":\"business\",\"kind\":\"attest\",\"outcome\":\"not read\",\"reason\":{\"code\":\"carried_from_earlier_reading\",\"version\":\"trooth.check-explanations.v1\",\"source_ref\":null,\"withheld\":true,\"withheld_reason\":\"The source is the company's own form declaration, which is not published; its reference is committed in the evidence manifest.\"}},{\"id\":\"B2\",\"category\":\"business\",\"kind\":\"attest\",\"outcome\":\"not read\",\"reason\":{\"code\":\"carried_from_earlier_reading\",\"version\":\"trooth.check-explanations.v1\",\"source_ref\":null,\"withheld\":true,\"withheld_reason\":\"The source is the company's own form declaration, which is not published; its reference is committed in the evidence manifest.\"}},{\"id\":\"B3\",\"category\":\"business\",\"kind\":\"probe\",\"outcome\":\"as expected\",\"reason\":null},{\"id\":\"B4\",\"category\":\"business\",\"kind\":\"probe\",\"outcome\":\"as expected\",\"reason\":null},{\"id\":\"B5\",\"category\":\"business\",\"kind\":\"probe\",\"outcome\":\"as expected\",\"reason\":null},{\"id\":\"B6\",\"category\":\"business\",\"kind\":\"probe\",\"outcome\":\"as expected\",\"reason\":null},{\"id\":\"B7\",\"category\":\"business\",\"kind\":\"attest\",\"outcome\":\"not read\",\"reason\":{\"code\":\"carried_from_earlier_reading\",\"version\":\"trooth.check-explanations.v1\",\"source_ref\":null,\"withheld\":true,\"withheld_reason\":\"The source is the company's own form declaration, which is not published; its reference is committed in the evidence manifest.\"}},{\"id\":\"B8\",\"category\":\"business\",\"kind\":\"probe\",\"outcome\":\"as expected\",\"reason\":null},{\"id\":\"B9\",\"category\":\"business\",\"kind\":\"probe\",\"outcome\":\"as expected\",\"reason\":null},{\"id\":\"B10\",\"category\":\"business\",\"kind\":\"attest\",\"outcome\":\"not read\",\"reason\":{\"code\":\"carried_from_earlier_reading\",\"version\":\"trooth.check-explanations.v1\",\"source_ref\":null,\"withheld\":true,\"withheld_reason\":\"The source is the company's own form declaration, which is not published; its reference is committed in the evidence manifest.\"}},{\"id\":\"I1\",\"category\":\"ip\",\"kind\":\"attest\",\"outcome\":\"not read\",\"reason\":{\"code\":\"carried_from_earlier_reading\",\"version\":\"trooth.check-explanations.v1\",\"source_ref\":null,\"withheld\":true,\"withheld_reason\":\"The source is the company's own form declaration, which is not published; its reference is committed in the evidence manifest.\"}},{\"id\":\"I2\",\"category\":\"ip\",\"kind\":\"attest\",\"outcome\":\"not read\",\"reason\":{\"code\":\"carried_from_earlier_reading\",\"version\":\"trooth.check-explanations.v1\",\"source_ref\":null,\"withheld\":true,\"withheld_reason\":\"The source is the company's own form declaration, which is not published; its reference is committed in the evidence manifest.\"}},{\"id\":\"I3\",\"category\":\"ip\",\"kind\":\"probe\",\"outcome\